{
  "ir_version": "1.0",
  "compiler_version": "1.1",
  "artifact_type": "field_inventory",
  "generated_at": "2026-06-25T10:19:35Z",
  "repository_commit": "f95b4fe91f273f7a6745f2f7d1de4733757db2dd",
  "provenance": {
    "artifact_id": "ART-FIELD-INV-00001",
    "produced_by": "Phase0_Discovery",
    "consumes": [
      "apps/smriti_retail_os/smriti_retail_os/setup.py"
    ],
    "used_by": [
      "docs_renderers",
      "dependency_graph"
    ]
  },
  "data": [
    {
      "artifact_id": "ART-FIELD-00134",
      "target_doctype": "SMRITI Company Settings",
      "fieldname": "custom_business_type",
      "label": "Business Type",
      "fieldtype": "Select",
      "evidence_type": "AST",
      "source_file": "apps/smriti_retail_os/smriti_retail_os/setup.py",
      "source_line": 2047,
      "checksum": "78fd37adc743d5dbbc89672996cb5e0d2ba0186eb4c7dad006c9cd4f70299407"
    },
    {
      "artifact_id": "ART-FIELD-00135",
      "target_doctype": "SMRITI Company Settings",
      "fieldname": "custom_print_profiles_json",
      "label": "Print Profiles JSON",
      "fieldtype": "Long Text",
      "evidence_type": "AST",
      "source_file": "apps/smriti_retail_os/smriti_retail_os/setup.py",
      "source_line": 2056,
      "checksum": "78fd37adc743d5dbbc89672996cb5e0d2ba0186eb4c7dad006c9cd4f70299407"
    },
    {
      "artifact_id": "ART-FIELD-00136",
      "target_doctype": "SMRITI Company Settings",
      "fieldname": "default_printer_ip",
      "label": "Default Printer IP",
      "fieldtype": "Data",
      "evidence_type": "AST",
      "source_file": "apps/smriti_retail_os/smriti_retail_os/setup.py",
      "source_line": 2063,
      "checksum": "78fd37adc743d5dbbc89672996cb5e0d2ba0186eb4c7dad006c9cd4f70299407"
    },
    {
      "artifact_id": "ART-FIELD-00137",
      "target_doctype": "SMRITI Company Settings",
      "fieldname": "default_printer_port",
      "label": "Default Printer Port",
      "fieldtype": "Int",
      "evidence_type": "AST",
      "source_file": "apps/smriti_retail_os/smriti_retail_os/setup.py",
      "source_line": 2070,
      "checksum": "78fd37adc743d5dbbc89672996cb5e0d2ba0186eb4c7dad006c9cd4f70299407"
    },
    {
      "artifact_id": "ART-FIELD-00138",
      "target_doctype": "SMRITI Company Settings",
      "fieldname": "default_printer_lang",
      "label": "Default Printer Language",
      "fieldtype": "Select",
      "evidence_type": "AST",
      "source_file": "apps/smriti_retail_os/smriti_retail_os/setup.py",
      "source_line": 2078,
      "checksum": "78fd37adc743d5dbbc89672996cb5e0d2ba0186eb4c7dad006c9cd4f70299407"
    },
    {
      "artifact_id": "ART-FIELD-00139",
      "target_doctype": "SMRITI Company Settings",
      "fieldname": "default_label_size",
      "label": "Default Label Size",
      "fieldtype": "Select",
      "evidence_type": "AST",
      "source_file": "apps/smriti_retail_os/smriti_retail_os/setup.py",
      "source_line": 2087,
      "checksum": "78fd37adc743d5dbbc89672996cb5e0d2ba0186eb4c7dad006c9cd4f70299407"
    },
    {
      "artifact_id": "ART-FIELD-00140",
      "target_doctype": "User",
      "fieldname": "custom_is_smriti_user",
      "label": "Is SMRITI User",
      "fieldtype": "Check",
      "evidence_type": "AST",
      "source_file": "apps/smriti_retail_os/smriti_retail_os/setup.py",
      "source_line": 2100,
      "checksum": "78fd37adc743d5dbbc89672996cb5e0d2ba0186eb4c7dad006c9cd4f70299407"
    },
    {
      "artifact_id": "ART-FIELD-00141",
      "target_doctype": "User",
      "fieldname": "custom_smriti_pin",
      "label": "SMRITI POS PIN",
      "fieldtype": "Password",
      "evidence_type": "AST",
      "source_file": "apps/smriti_retail_os/smriti_retail_os/setup.py",
      "source_line": 2108,
      "checksum": "78fd37adc743d5dbbc89672996cb5e0d2ba0186eb4c7dad006c9cd4f70299407"
    },
    {
      "artifact_id": "ART-FIELD-00142",
      "target_doctype": "Loyalty Point Entry",
      "fieldname": "remaining_points",
      "label": "Remaining Points",
      "fieldtype": "Float",
      "evidence_type": "AST",
      "source_file": "apps/smriti_retail_os/smriti_retail_os/setup.py",
      "source_line": 2117,
      "checksum": "78fd37adc743d5dbbc89672996cb5e0d2ba0186eb4c7dad006c9cd4f70299407"
    },
    {
      "artifact_id": "ART-FIELD-00143",
      "target_doctype": "POS Invoice",
      "fieldname": "custom_is_held",
      "label": "Is Held",
      "fieldtype": "Check",
      "evidence_type": "AST",
      "source_file": "apps/smriti_retail_os/smriti_retail_os/setup.py",
      "source_line": 2127,
      "checksum": "78fd37adc743d5dbbc89672996cb5e0d2ba0186eb4c7dad006c9cd4f70299407"
    },
    {
      "artifact_id": "ART-FIELD-00144",
      "target_doctype": "POS Invoice",
      "fieldname": "custom_held_by",
      "label": "Held By",
      "fieldtype": "Link",
      "evidence_type": "AST",
      "source_file": "apps/smriti_retail_os/smriti_retail_os/setup.py",
      "source_line": 2136,
      "checksum": "78fd37adc743d5dbbc89672996cb5e0d2ba0186eb4c7dad006c9cd4f70299407"
    },
    {
      "artifact_id": "ART-FIELD-00145",
      "target_doctype": "POS Invoice",
      "fieldname": "custom_hold_time",
      "label": "Hold Time",
      "fieldtype": "Datetime",
      "evidence_type": "AST",
      "source_file": "apps/smriti_retail_os/smriti_retail_os/setup.py",
      "source_line": 2145,
      "checksum": "78fd37adc743d5dbbc89672996cb5e0d2ba0186eb4c7dad006c9cd4f70299407"
    },
    {
      "artifact_id": "ART-FIELD-00146",
      "target_doctype": "POS Invoice",
      "fieldname": "custom_billing_session_id",
      "label": "Billing Session ID",
      "fieldtype": "Data",
      "evidence_type": "AST",
      "source_file": "apps/smriti_retail_os/smriti_retail_os/setup.py",
      "source_line": 2153,
      "checksum": "78fd37adc743d5dbbc89672996cb5e0d2ba0186eb4c7dad006c9cd4f70299407"
    },
    {
      "artifact_id": "ART-FIELD-00147",
      "target_doctype": "POS Invoice",
      "fieldname": "custom_wallet_deduction",
      "label": "Wallet Deduction",
      "fieldtype": "Currency",
      "evidence_type": "AST",
      "source_file": "apps/smriti_retail_os/smriti_retail_os/setup.py",
      "source_line": 2162,
      "checksum": "78fd37adc743d5dbbc89672996cb5e0d2ba0186eb4c7dad006c9cd4f70299407"
    },
    {
      "artifact_id": "ART-FIELD-00148",
      "target_doctype": "POS Invoice",
      "fieldname": "custom_loyalty_points_earned",
      "label": "Loyalty Points Earned",
      "fieldtype": "Float",
      "evidence_type": "AST",
      "source_file": "apps/smriti_retail_os/smriti_retail_os/setup.py",
      "source_line": 2170,
      "checksum": "78fd37adc743d5dbbc89672996cb5e0d2ba0186eb4c7dad006c9cd4f70299407"
    },
    {
      "artifact_id": "ART-FIELD-00149",
      "target_doctype": "POS Invoice",
      "fieldname": "custom_coupon_discount",
      "label": "Coupon Discount",
      "fieldtype": "Currency",
      "evidence_type": "AST",
      "source_file": "apps/smriti_retail_os/smriti_retail_os/setup.py",
      "source_line": 2178,
      "checksum": "78fd37adc743d5dbbc89672996cb5e0d2ba0186eb4c7dad006c9cd4f70299407"
    },
    {
      "artifact_id": "ART-FIELD-00150",
      "target_doctype": "Item",
      "fieldname": "custom_mrp",
      "label": "MRP (Maximum Retail Price)",
      "fieldtype": "Currency",
      "evidence_type": "AST",
      "source_file": "apps/smriti_retail_os/smriti_retail_os/setup.py",
      "source_line": 2188,
      "checksum": "78fd37adc743d5dbbc89672996cb5e0d2ba0186eb4c7dad006c9cd4f70299407"
    },
    {
      "artifact_id": "ART-FIELD-00151",
      "target_doctype": "Item",
      "fieldname": "custom_gst_percentage",
      "label": "GST Percentage (%)",
      "fieldtype": "Select",
      "evidence_type": "AST",
      "source_file": "apps/smriti_retail_os/smriti_retail_os/setup.py",
      "source_line": 2196,
      "checksum": "78fd37adc743d5dbbc89672996cb5e0d2ba0186eb4c7dad006c9cd4f70299407"
    },
    {
      "artifact_id": "ART-FIELD-00152",
      "target_doctype": "Item",
      "fieldname": "custom_is_retail_item",
      "label": "Is Retail Item",
      "fieldtype": "Check",
      "evidence_type": "AST",
      "source_file": "apps/smriti_retail_os/smriti_retail_os/setup.py",
      "source_line": 2204,
      "checksum": "78fd37adc743d5dbbc89672996cb5e0d2ba0186eb4c7dad006c9cd4f70299407"
    },
    {
      "artifact_id": "ART-FIELD-00153",
      "target_doctype": "Item",
      "fieldname": "custom_department",
      "label": "Department",
      "fieldtype": "Link",
      "evidence_type": "AST",
      "source_file": "apps/smriti_retail_os/smriti_retail_os/setup.py",
      "source_line": 2212,
      "checksum": "78fd37adc743d5dbbc89672996cb5e0d2ba0186eb4c7dad006c9cd4f70299407"
    },
    {
      "artifact_id": "ART-FIELD-00099",
      "target_doctype": "Item",
      "fieldname": "custom_barcode_size",
      "label": "Barcode Size",
      "fieldtype": "Select",
      "evidence_type": "AST",
      "source_file": "apps/smriti_retail_os/smriti_retail_os/setup.py",
      "source_line": 2220,
      "checksum": "78fd37adc743d5dbbc89672996cb5e0d2ba0186eb4c7dad006c9cd4f70299407"
    },
    {
      "artifact_id": "ART-FIELD-00154",
      "target_doctype": "Item",
      "fieldname": "custom_current_stock_html",
      "label": "Current Stock HTML",
      "fieldtype": "HTML",
      "evidence_type": "AST",
      "source_file": "apps/smriti_retail_os/smriti_retail_os/setup.py",
      "source_line": 2228,
      "checksum": "78fd37adc743d5dbbc89672996cb5e0d2ba0186eb4c7dad006c9cd4f70299407"
    },
    {
      "artifact_id": "ART-FIELD-00155",
      "target_doctype": "Item",
      "fieldname": "custom_purchase_class",
      "label": "Purchase Class",
      "fieldtype": "Link",
      "evidence_type": "AST",
      "source_file": "apps/smriti_retail_os/smriti_retail_os/setup.py",
      "source_line": 2236,
      "checksum": "78fd37adc743d5dbbc89672996cb5e0d2ba0186eb4c7dad006c9cd4f70299407"
    },
    {